{
  "version": "1.0",
  "generatedAt": "2026-09-23T00:00:00.000Z",
  "nodes": [
    { "id": "buscar-profesor-ingles", "title": "Buscar profesor de inglés", "description": "Buscar en redes o academias un profesor particular o grupo de conversación.", "estimatedMinutes": 20, "priority": 3 },
    { "id": "aprender-ingles", "title": "Aprender inglés", "description": "Clases regulares, al menos 2 veces por semana.", "estimatedMinutes": 0, "priority": 3 },
    { "id": "practicar-ingles-conversacion", "title": "Practicar conversación en inglés", "description": "30 minutos de conversación real, no solo gramática.", "estimatedMinutes": 30, "priority": 3 },
    { "id": "actualizar-cv", "title": "Actualizar el CV", "description": "Versión en inglés, orientada a trabajo remoto.", "estimatedMinutes": 45, "priority": 4 },
    { "id": "crear-portafolio-online", "title": "Crear portafolio online", "description": "Una página simple con 3-4 proyectos representativos.", "estimatedMinutes": 90, "priority": 3 },
    { "id": "investigar-empresas-remotas", "title": "Investigar empresas remotas", "description": "Lista de 15-20 empresas que contratan 100% remoto en tu área.", "estimatedMinutes": 40, "priority": 3 },
    { "id": "mejorar-perfil-linkedin", "title": "Mejorar perfil de LinkedIn", "description": "Titular, resumen y experiencia orientados a remoto.", "estimatedMinutes": 35, "priority": 2 },
    { "id": "pedir-recomendaciones-linkedin", "title": "Pedir recomendaciones en LinkedIn", "description": "Al menos 3 recomendaciones de excompañeros o jefes.", "estimatedMinutes": 15, "priority": 2 },
    { "id": "aplicar-vacantes-remotas", "title": "Aplicar a vacantes remotas", "description": "Al menos 5 aplicaciones en plataformas serias.", "estimatedMinutes": 60, "priority": 4 },
    { "id": "configurar-espacio-trabajo-casa", "title": "Configurar espacio de trabajo en casa", "description": "Escritorio, luz e internet estables para videollamadas.", "estimatedMinutes": 50, "priority": 2 },
    { "id": "probar-videollamada-equipo", "title": "Probar videollamada con buen audio", "description": "Grabarte 2 minutos y revisar audio, luz y fondo.", "estimatedMinutes": 15, "priority": 2 },
    { "id": "preparar-entrevistas", "title": "Preparar respuestas para entrevistas", "description": "Practicar preguntas comunes en inglés y español.", "estimatedMinutes": 40, "priority": 3 },
    { "id": "conseguir-trabajo-remoto", "title": "Conseguir trabajo remoto", "description": "El objetivo final: firmar un contrato de trabajo 100% remoto.", "estimatedMinutes": 0, "priority": 9 },

    { "id": "elegir-curso-programacion", "title": "Elegir curso de programación", "description": "Comparar 3 opciones y elegir una según tu tiempo disponible.", "estimatedMinutes": 30, "priority": 2 },
    { "id": "completar-modulo-basico", "title": "Completar el módulo básico", "description": "Terminar los fundamentos antes de pasar a proyectos.", "estimatedMinutes": 0, "priority": 2 },
    { "id": "construir-proyecto-tecnico", "title": "Construir un proyecto técnico propio", "description": "Algo pequeño pero completo, para mostrar en el portafolio.", "estimatedMinutes": 180, "priority": 3 },

    { "id": "revisar-gastos-mensuales", "title": "Revisar gastos mensuales", "description": "Listar todos los gastos fijos del último trimestre.", "estimatedMinutes": 30, "priority": 2 },
    { "id": "cancelar-suscripciones-innecesarias", "title": "Cancelar suscripciones que no usas", "description": "Revisar streaming, apps y membresías olvidadas.", "estimatedMinutes": 20, "priority": 2 },
    { "id": "ahorrar-fondo-emergencia", "title": "Empezar el fondo de emergencia", "description": "Transferencia automática apenas llega el sueldo.", "estimatedMinutes": 10, "priority": 3 },
    { "id": "automatizar-transferencia-ahorro", "title": "Automatizar la transferencia de ahorro", "description": "Configurar el banco para que se haga sola cada mes.", "estimatedMinutes": 15, "priority": 3 },
    { "id": "tener-3-meses-de-ahorro", "title": "Tener 3 meses de gastos ahorrados", "description": "Objetivo: colchón financiero antes de dar el siguiente paso.", "estimatedMinutes": 0, "priority": 7 },

    { "id": "fijar-hora-de-dormir", "title": "Fijar una hora fija para dormir", "description": "Misma hora todos los días, incluidos fines de semana.", "estimatedMinutes": 5, "priority": 2 },
    { "id": "dormir-7-horas", "title": "Dormir al menos 7 horas", "description": "Sin pantallas la última media hora antes de dormir.", "estimatedMinutes": 0, "priority": 3 },
    { "id": "comprar-tenis-deportivos", "title": "Comprar tenis para hacer ejercicio", "description": "Unos cómodos, no hace falta que sean caros.", "estimatedMinutes": 40, "priority": 1 },
    { "id": "elegir-rutina-ejercicio", "title": "Elegir una rutina de ejercicio simple", "description": "20-30 minutos, algo que puedas sostener en el tiempo.", "estimatedMinutes": 25, "priority": 2 },
    { "id": "hacer-ejercicio-3-veces-semana", "title": "Hacer ejercicio 3 veces por semana", "description": "Constancia antes que intensidad.", "estimatedMinutes": 0, "priority": 3 },
    { "id": "tener-mas-energia-cada-dia", "title": "Tener más energía cada día", "description": "Objetivo: sentirte con más energía de forma sostenida.", "estimatedMinutes": 0, "priority": 6 }
  ],
  "edges": [
    { "from": "buscar-profesor-ingles", "to": "aprender-ingles" },
    { "from": "aprender-ingles", "to": "practicar-ingles-conversacion" },
    { "from": "actualizar-cv", "to": "crear-portafolio-online" },
    { "from": "construir-proyecto-tecnico", "to": "crear-portafolio-online" },
    { "from": "mejorar-perfil-linkedin", "to": "pedir-recomendaciones-linkedin" },
    { "from": "practicar-ingles-conversacion", "to": "aplicar-vacantes-remotas" },
    { "from": "crear-portafolio-online", "to": "aplicar-vacantes-remotas" },
    { "from": "investigar-empresas-remotas", "to": "aplicar-vacantes-remotas" },
    { "from": "pedir-recomendaciones-linkedin", "to": "aplicar-vacantes-remotas" },
    { "from": "configurar-espacio-trabajo-casa", "to": "probar-videollamada-equipo" },
    { "from": "aplicar-vacantes-remotas", "to": "preparar-entrevistas" },
    { "from": "probar-videollamada-equipo", "to": "preparar-entrevistas" },
    { "from": "preparar-entrevistas", "to": "conseguir-trabajo-remoto" },

    { "from": "elegir-curso-programacion", "to": "completar-modulo-basico" },
    { "from": "completar-modulo-basico", "to": "construir-proyecto-tecnico" },

    { "from": "revisar-gastos-mensuales", "to": "cancelar-suscripciones-innecesarias" },
    { "from": "cancelar-suscripciones-innecesarias", "to": "ahorrar-fondo-emergencia" },
    { "from": "ahorrar-fondo-emergencia", "to": "automatizar-transferencia-ahorro" },
    { "from": "automatizar-transferencia-ahorro", "to": "tener-3-meses-de-ahorro" },

    { "from": "fijar-hora-de-dormir", "to": "dormir-7-horas" },
    { "from": "comprar-tenis-deportivos", "to": "elegir-rutina-ejercicio" },
    { "from": "elegir-rutina-ejercicio", "to": "hacer-ejercicio-3-veces-semana" },
    { "from": "dormir-7-horas", "to": "hacer-ejercicio-3-veces-semana" },
    { "from": "hacer-ejercicio-3-veces-semana", "to": "tener-mas-energia-cada-dia" }
  ]
}
